{
  "$schema": "../../schemas/ability-index.schema.json",
  "schemaVersion": 1,
  "recordType": "ability-index",
  "id": "midnight-season-2/flagged-abilities",
  "status": "draft",
  "validity": {
    "fromBuild": "12.1.0.69587",
    "untilBuild": null,
    "seasonId": null,
    "seasonSlug": "midnight-season-2"
  },
  "seasonSlug": "midnight-season-2",
  "abilityRowCount": 149,
  "abilities": [
    {
      "spellId": 267027,
      "name": "Poison Spit",
      "responseTags": [
        "interrupt",
        "cleanse-poison"
      ],
      "contexts": [
        {
          "dungeonId": "temple-of-sethraliss",
          "instanceMapId": 1877,
          "npcId": 134389,
          "npcName": "Toxic Viper",
          "interruptible": true,
          "dispelType": "poison",
          "enrage": false
        }
      ]
    },
    {
      "spellId": 267273,
      "name": "Poison Nova",
      "responseTags": [
        "interrupt",
        "cleanse-poison"
      ],
      "contexts": [
        {
          "dungeonId": "kings-rest",
          "instanceMapId": 1762,
          "npcId": 269810,
          "npcName": "Zanazal the Wise",
          "interruptible": true,
          "dispelType": "poison",
          "enrage": false
        }
      ]
    },
    {
      "spellId": 267763,
      "name": "Wretched Discharge",
      "responseTags": [
        "interrupt",
        "cleanse-disease"
      ],
      "contexts": [
        {
          "dungeonId": "kings-rest",
          "instanceMapId": 1762,
          "npcId": 270502,
          "npcName": "Half-Finished Mummy",
          "interruptible": true,
          "dispelType": "disease",
          "enrage": false
        }
      ]
    },
    {
      "spellId": 268013,
      "name": "Flame Shock",
      "responseTags": [
        "interrupt"
      ],
      "contexts": [
        {
          "dungeonId": "temple-of-sethraliss",
          "instanceMapId": 1877,
          "npcId": 136250,
          "npcName": "Twisted Hexxer",
          "interruptible": true,
          "dispelType": "none",
          "enrage": false
        }
      ]
    },
    {
      "spellId": 269369,
      "name": "Deathly Roar",
      "responseTags": [
        "interrupt"
      ],
      "contexts": [
        {
          "dungeonId": "kings-rest",
          "instanceMapId": 1762,
          "npcId": 136984,
          "npcName": "Reban",
          "interruptible": true,
          "dispelType": "none",
          "enrage": false
        }
      ]
    },
    {
      "spellId": 269935,
      "name": "Bound by Shadow",
      "responseTags": [
        "dispel-magic"
      ],
      "contexts": [
        {
          "dungeonId": "kings-rest",
          "instanceMapId": 1762,
          "npcId": 133943,
          "npcName": "Minion of Zul",
          "interruptible": false,
          "dispelType": "magic",
          "enrage": false
        },
        {
          "dungeonId": "kings-rest",
          "instanceMapId": 1762,
          "npcId": 138493,
          "npcName": "Minion of Zul",
          "interruptible": false,
          "dispelType": "magic",
          "enrage": false
        }
      ]
    },
    {
      "spellId": 269972,
      "name": "Hex Volley",
      "responseTags": [
        "interrupt",
        "cleanse-curse"
      ],
      "contexts": [
        {
          "dungeonId": "kings-rest",
          "instanceMapId": 1762,
          "npcId": 134174,
          "npcName": "Risen Hexer",
          "interruptible": true,
          "dispelType": "curse",
          "enrage": false
        }
      ]
    },
    {
      "spellId": 269976,
      "name": "Ancestral Fury",
      "responseTags": [
        "soothe"
      ],
      "contexts": [
        {
          "dungeonId": "kings-rest",
          "instanceMapId": 1762,
          "npcId": 134158,
          "npcName": "Shadow-Borne Champion",
          "interruptible": false,
          "dispelType": "none",
          "enrage": true
        }
      ]
    },
    {
      "spellId": 270492,
      "name": "Hex",
      "responseTags": [
        "interrupt",
        "cleanse-curse"
      ],
      "contexts": [
        {
          "dungeonId": "kings-rest",
          "instanceMapId": 1762,
          "npcId": 135204,
          "npcName": "Phantom Hex Priest",
          "interruptible": true,
          "dispelType": "curse",
          "enrage": false
        }
      ]
    },
    {
      "spellId": 270499,
      "name": "Frost Shock",
      "responseTags": [
        "dispel-magic"
      ],
      "contexts": [
        {
          "dungeonId": "kings-rest",
          "instanceMapId": 1762,
          "npcId": 135239,
          "npcName": "Spectral Shaman",
          "interruptible": false,
          "dispelType": "magic",
          "enrage": false
        }
      ]
    },
    {
      "spellId": 270901,
      "name": "Unholy Mending",
      "responseTags": [
        "interrupt",
        "dispel-magic"
      ],
      "contexts": [
        {
          "dungeonId": "kings-rest",
          "instanceMapId": 1762,
          "npcId": 134251,
          "npcName": "Seneschal M'bara",
          "interruptible": true,
          "dispelType": "magic",
          "enrage": false
        }
      ]
    },
    {
      "spellId": 270920,
      "name": "Bind Soul",
      "responseTags": [
        "interrupt",
        "dispel-magic"
      ],
      "contexts": [
        {
          "dungeonId": "kings-rest",
          "instanceMapId": 1762,
          "npcId": 137478,
          "npcName": "Queen Wasi",
          "interruptible": true,
          "dispelType": "magic",
          "enrage": false
        }
      ]
    },
    {
      "spellId": 371984,
      "name": "Frostbolt",
      "responseTags": [
        "interrupt"
      ],
      "contexts": [
        {
          "dungeonId": "ruby-life-pools",
          "instanceMapId": 2521,
          "npcId": 188067,
          "npcName": "Flashfrost Chillweaver",
          "interruptible": true,
          "dispelType": "none",
          "enrage": false
        }
      ]
    },
    {
      "spellId": 372743,
      "name": "Ice Shield",
      "responseTags": [
        "interrupt"
      ],
      "contexts": [
        {
          "dungeonId": "ruby-life-pools",
          "instanceMapId": 2521,
          "npcId": 188067,
          "npcName": "Flashfrost Chillweaver",
          "interruptible": true,
          "dispelType": "none",
          "enrage": false
        }
      ]
    },
    {
      "spellId": 372808,
      "name": "Frigid Shard",
      "responseTags": [
        "interrupt"
      ],
      "contexts": [
        {
          "dungeonId": "ruby-life-pools",
          "instanceMapId": 2521,
          "npcId": 188252,
          "npcName": "Melidrussa Chillworn",
          "interruptible": true,
          "dispelType": "none",
          "enrage": false
        }
      ]
    },
    {
      "spellId": 373017,
      "name": "Blaze Volley",
      "responseTags": [
        "interrupt"
      ],
      "contexts": [
        {
          "dungeonId": "ruby-life-pools",
          "instanceMapId": 2521,
          "npcId": 189886,
          "npcName": "Blazebound Firestorm",
          "interruptible": true,
          "dispelType": "none",
          "enrage": false
        }
      ]
    },
    {
      "spellId": 373972,
      "name": "Blaze of Glory",
      "responseTags": [
        "dispel-magic"
      ],
      "contexts": [
        {
          "dungeonId": "ruby-life-pools",
          "instanceMapId": 2521,
          "npcId": 190206,
          "npcName": "Ashseer Flamelasher",
          "interruptible": false,
          "dispelType": "magic",
          "enrage": false
        }
      ]
    },
    {
      "spellId": 381515,
      "name": "Stormslam",
      "responseTags": [
        "dispel-magic"
      ],
      "contexts": [
        {
          "dungeonId": "ruby-life-pools",
          "instanceMapId": 2521,
          "npcId": 190485,
          "npcName": "Erkhart Stormvein",
          "interruptible": false,
          "dispelType": "magic",
          "enrage": false
        }
      ]
    },
    {
      "spellId": 384194,
      "name": "Cinderbolt",
      "responseTags": [
        "interrupt"
      ],
      "contexts": [
        {
          "dungeonId": "ruby-life-pools",
          "instanceMapId": 2521,
          "npcId": 190207,
          "npcName": "Primalist Cinderweaver",
          "interruptible": true,
          "dispelType": "none",
          "enrage": false
        }
      ]
    },
    {
      "spellId": 384933,
      "name": "Ice Shield",
      "responseTags": [
        "interrupt"
      ],
      "contexts": [
        {
          "dungeonId": "ruby-life-pools",
          "instanceMapId": 2521,
          "npcId": 188011,
          "npcName": "Earthbound Guardian",
          "interruptible": true,
          "dispelType": "none",
          "enrage": false
        },
        {
          "dungeonId": "ruby-life-pools",
          "instanceMapId": 2521,
          "npcId": 188067,
          "npcName": "Flashfrost Chillweaver",
          "interruptible": true,
          "dispelType": "none",
          "enrage": false
        }
      ]
    },
    {
      "spellId": 385310,
      "name": "Storm Bolt",
      "responseTags": [
        "interrupt"
      ],
      "contexts": [
        {
          "dungeonId": "ruby-life-pools",
          "instanceMapId": 2521,
          "npcId": 195119,
          "npcName": "Ruinous Stormbringer",
          "interruptible": true,
          "dispelType": "none",
          "enrage": false
        }
      ]
    },
    {
      "spellId": 391031,
      "name": "Stormcloud Barrier",
      "responseTags": [
        "dispel-magic"
      ],
      "contexts": [
        {
          "dungeonId": "ruby-life-pools",
          "instanceMapId": 2521,
          "npcId": 197509,
          "npcName": "Primal Thundercloud",
          "interruptible": false,
          "dispelType": "magic",
          "enrage": false
        }
      ]
    },
    {
      "spellId": 392576,